,review_id,business_id,useful,funny,cool,text,name,address,city,state,city||state,postal_code,latitude,longitude,stars,review_count,categories
248,v9IoVoHZ97-9hCkpEqwCWw,rN3XnPL0hqE-7qBUfAbCTg,1,0,0,"Came here with my bestie on a Friday night, and had a great time. My friend had arrived before me, but didn't have to wait more than 5 minutes to be seated (Friday at 6:15). Our waitress was just the sweetest. It had been a long week, so I was deserving of a large glass of white wine (haha), and she recommended a great choice. My friend had their ahi tuna, and I decided to try the lobster and shrimp salad. It. was. delicious. Probably one of the best salads I have ever had! The shrimp and lobster were super fresh, the dressing was delicious, and the salad had all of my favourite foods - avocado, beans, and mushrooms. Yummy!! The ambiance was great, one of those nicer restaurants you can bring your kids to without feeling out of place. Sometimes restaurants hand you the bill with the underlying reason that ""it's time for you to go"", but our waitress told us to enjoy and take our time, which was nice not to feel rushed. That being said. I shall be back...for that salad! ;)",The Keg Steakhouse + Bar - Pointe-Claire,6815 Autoroute Transcanadienne F017,Pointe-Claire,QC,Pointe-ClaireQC,H9R 1C4,45.4640803605,-73.8300067602,4.0,47,"Bars, Nightlife, Seafood, Steakhouses, Restaurants, Canadian (New)"
249,K0m7wELJ9HnKGU0JUQEOCw,rN3XnPL0hqE-7qBUfAbCTg,3,0,1,"Surprised they don't take reservations. Food was good but you must be a steak lover to fully enjoy the experience. I am not big on steak but figured I should still have that since it's what they are most famous for. It was quite nice my manhattan ny cut. 

Will not be going back as I am not a true beef fan and being that prices are on the higher end.:.",The Keg Steakhouse + Bar - Pointe-Claire,6815 Autoroute Transcanadienne F017,Pointe-Claire,QC,Pointe-ClaireQC,H9R 1C4,45.4640803605,-73.8300067602,4.0,47,"Bars, Nightlife, Seafood, Steakhouses, Restaurants, Canadian (New)"
250,4F7CTbgnw3-kp3jFe2RMGg,rN3XnPL0hqE-7qBUfAbCTg,0,0,0,"Great food, drinks and ambiance ! Enjoy the rooftop in the summer but try to reserve in advance during those months!",The Keg Steakhouse + Bar - Pointe-Claire,6815 Autoroute Transcanadienne F017,Pointe-Claire,QC,Pointe-ClaireQC,H9R 1C4,45.4640803605,-73.8300067602,4.0,47,"Bars, Nightlife, Seafood, Steakhouses, Restaurants, Canadian (New)"
251,JLCz0zNVPt60V3kFoEUZ1g,rN3XnPL0hqE-7qBUfAbCTg,1,0,1,"YUM! Delicious steaks, sides, appetizers and very interesting drink menu. The ambiance is amazing, and the service was great. Highly recommended!",The Keg Steakhouse + Bar - Pointe-Claire,6815 Autoroute Transcanadienne F017,Pointe-Claire,QC,Pointe-ClaireQC,H9R 1C4,45.4640803605,-73.8300067602,4.0,47,"Bars, Nightlife, Seafood, Steakhouses, Restaurants, Canadian (New)"
252,jYAis1Okqi1NpZ-ntnYq4A,rN3XnPL0hqE-7qBUfAbCTg,0,0,0,"Didn't even get to sit down. We were a party of six including two children and were told that we would need to wait an hour and a half for a table, even though there were several tables empty, supposedly all reserved.",The Keg Steakhouse + Bar - Pointe-Claire,6815 Autoroute Transcanadienne F017,Pointe-Claire,QC,Pointe-ClaireQC,H9R 1C4,45.4640803605,-73.8300067602,4.0,47,"Bars, Nightlife, Seafood, Steakhouses, Restaurants, Canadian (New)"
253,UM2jCaJegKtfImD5y-_7lw,rN3XnPL0hqE-7qBUfAbCTg,0,0,0,"we went a night or two after they opened.  the interior is very neat, it should have been since it cost almost 9m to make the space.  I love the bar staff very friendly and beautiful.  

i ordered let the server order me a steak and it was perfect (the rib).  the rest of the party steaks were not cooked to their liking but still enjoyed them.  you must try the ice cream cake... AMAZING",The Keg Steakhouse + Bar - Pointe-Claire,6815 Autoroute Transcanadienne F017,Pointe-Claire,QC,Pointe-ClaireQC,H9R 1C4,45.4640803605,-73.8300067602,4.0,47,"Bars, Nightlife, Seafood, Steakhouses, Restaurants, Canadian (New)"
254,A0J1hk2j7NfdBQ3GtoZsgQ,rN3XnPL0hqE-7qBUfAbCTg,1,1,1,"Just an absolutely lovely experience coming here. We had a very attentive waiter who suggested some very good choices on the menu along with some beautiful wine pairing to make this night very special. I asked for a rare peppercorn steak and receive exactly that, paired with a sweet and tangy steak dressing. This was paired along with a delicious red wine Zinfandel. Absolutely looking forward to coming back!",The Keg Steakhouse + Bar - Pointe-Claire,6815 Autoroute Transcanadienne F017,Pointe-Claire,QC,Pointe-ClaireQC,H9R 1C4,45.4640803605,-73.8300067602,4.0,47,"Bars, Nightlife, Seafood, Steakhouses, Restaurants, Canadian (New)"
255,Dafxg4daB8YPn_h0c6PtRA,rN3XnPL0hqE-7qBUfAbCTg,0,0,0,Came for our 14th anniversary food was excellent service was great and the restaurant is beautiful and you dont even know that is attached to Fairview shopping center.,The Keg Steakhouse + Bar - Pointe-Claire,6815 Autoroute Transcanadienne F017,Pointe-Claire,QC,Pointe-ClaireQC,H9R 1C4,45.4640803605,-73.8300067602,4.0,47,"Bars, Nightlife, Seafood, Steakhouses, Restaurants, Canadian (New)"
256,c4eL6t29H4OkreW0_pJPhA,rN3XnPL0hqE-7qBUfAbCTg,1,0,0,The Keg steakhouse location on the west island is really nice and upscale. The staff are very well organized in handling the customers as they arrive. We had a reservation for 5:30 and were seated within 5 minutes of arriving. We were not impressed when they told us we had be out by 9pm. We understand but do not push us before we even get seated. Not a good start. We started out with house fresh mixes salads. Well when you find the core of the head of lettuce that is brown and cut into your salad sure displays poor quality control and was turn off. The server did take the brown core pieces away. A few minutes later the manager did show up at our table . He was apologetic  but then he start making excuses. The steaks arrived which mine was suppose to be medium but was partially on a rare side and was not hot but warm. But the bake potato was cold . At this point our server was no where to be found . A few minutes into our meal the manager did come by to see if everything was ok. I did ask him to  touch my potato to see first hand that the potato was cold . He was hesitant at first but when he did touch it he immediately agreed and stated that this was unacceptable . He said he would get me a hot potato. When he did return he stated that he was not happy with our experience and was taking it off the bill. That was the right way to handle the matter . That being said the kitchen staff and chef should understand when someone is spending a lot of money for a steak and salad they do expect everything to be perfect and not sloppy. We will give this location another try and we will update the review . Tonight The Keg was a miss !,The Keg Steakhouse + Bar - Pointe-Claire,6815 Autoroute Transcanadienne F017,Pointe-Claire,QC,Pointe-ClaireQC,H9R 1C4,45.4640803605,-73.8300067602,4.0,47,"Bars, Nightlife, Seafood, Steakhouses, Restaurants, Canadian (New)"
257,-QxXtMOmOrjq-lhZteJ3Cw,rN3XnPL0hqE-7qBUfAbCTg,0,0,0,Great place to watch the game. Steaks are meh but the appetizers and lobster keep me coming back!,The Keg Steakhouse + Bar - Pointe-Claire,6815 Autoroute Transcanadienne F017,Pointe-Claire,QC,Pointe-ClaireQC,H9R 1C4,45.4640803605,-73.8300067602,4.0,47,"Bars, Nightlife, Seafood, Steakhouses, Restaurants, Canadian (New)"
258,NWAZlr2scnUnbc1cD2wUwg,rN3XnPL0hqE-7qBUfAbCTg,1,0,0,"Totally recommend going here for a great night out. I have been there multiple times and have always had great service and great food. Is perfect for a romantic night out or even a fun night out with a group of friends. Prices aren't too high and you definitely get what you pay for, love it.",The Keg Steakhouse + Bar - Pointe-Claire,6815 Autoroute Transcanadienne F017,Pointe-Claire,QC,Pointe-ClaireQC,H9R 1C4,45.4640803605,-73.8300067602,4.0,47,"Bars, Nightlife, Seafood, Steakhouses, Restaurants, Canadian (New)"
259,XBhDbTbNWQTwjzECufzIlA,rN3XnPL0hqE-7qBUfAbCTg,0,0,0,Delicious food with beautiful ambiance. The location of the restaurant in Montreal makes it very nice.,The Keg Steakhouse + Bar - Pointe-Claire,6815 Autoroute Transcanadienne F017,Pointe-Claire,QC,Pointe-ClaireQC,H9R 1C4,45.4640803605,-73.8300067602,4.0,47,"Bars, Nightlife, Seafood, Steakhouses, Restaurants, Canadian (New)"
260,3Y-BBZ71eizpYUlDAGGlIw,rN3XnPL0hqE-7qBUfAbCTg,0,0,0,"Over the years of going to the keg, I've never had a steak not cooked to perfection. They also give reassurance if you've indicated any allergy to the waiter, 2 min later someone else comes to ensure that they're prepping the kitchen to account for this allergy. It's very comforting for those who're worried about this.",The Keg Steakhouse + Bar - Pointe-Claire,6815 Autoroute Transcanadienne F017,Pointe-Claire,QC,Pointe-ClaireQC,H9R 1C4,45.4640803605,-73.8300067602,4.0,47,"Bars, Nightlife, Seafood, Steakhouses, Restaurants, Canadian (New)"
261,1E-7u5A37M76MtnlYmxF3w,rN3XnPL0hqE-7qBUfAbCTg,6,2,1,"TLDR: Fun place for a 5 a 7 and for parties in the West end.

Great 5 a 7 deals of well-made cocktails and food. You can't go wrong with the cocktails. I've tried the dark and stormy, tequila cinnamon, bloody mary, and much more and they were all well balanced. If you prefer virgin drinks, their Virgin Mary has quite the kick to it. Their wine and beer lists are also nice. 

Let's discuss the food:
Their nachos are vibrant in colour and flavour, and I recommend topping them with chicken.
The fried calamari comes with fried red bell peppers and fried slices of jalapeno for some extra flavour.
Their house salad is great for people who are peckish but would rather drink their calories than eat them.

Service is efficient, even when involving large groups.

If you're looking for a more sophisticated place to hold your gathering in the west end, instead of a pub, this chain is for you.",The Keg Steakhouse + Bar - Pointe-Claire,6815 Autoroute Transcanadienne F017,Pointe-Claire,QC,Pointe-ClaireQC,H9R 1C4,45.4640803605,-73.8300067602,4.0,47,"Bars, Nightlife, Seafood, Steakhouses, Restaurants, Canadian (New)"
262,WQyDYUaKAtYMwotfb2aYmw,rN3XnPL0hqE-7qBUfAbCTg,4,0,0,Never disappoints. Best Keg location in the city. Been to the others and always am disappointed. Each meal I've had at this location has been better then the last. The service is top notch and not to mention walking in on a Saturday night and waiting less then 5 minutes for a table for 4 - can't be beat!!,The Keg Steakhouse + Bar - Pointe-Claire,6815 Autoroute Transcanadienne F017,Pointe-Claire,QC,Pointe-ClaireQC,H9R 1C4,45.4640803605,-73.8300067602,4.0,47,"Bars, Nightlife, Seafood, Steakhouses, Restaurants, Canadian (New)"
263,YVUYzIx0nJNruuGUK_bq-w,rN3XnPL0hqE-7qBUfAbCTg,2,1,1,"Over-priced with mediocre food.

The rib steak was well done, charred on the outside, even though I asked for medium well and slightly pink inside. The food of my parents was also poor quality with excessive spices. The place relies on spices it seems, to mask the average quality of its beef!

Service took about 45 minutes to get the main courses and even the appetizers took 15 minutes (or more) to arrive. For the ridiculous price of $41 for the rib steak, the cooking quality was a rip off!

Will avoid this over-rated money trap in the future!",The Keg Steakhouse + Bar - Pointe-Claire,6815 Autoroute Transcanadienne F017,Pointe-Claire,QC,Pointe-ClaireQC,H9R 1C4,45.4640803605,-73.8300067602,4.0,47,"Bars, Nightlife, Seafood, Steakhouses, Restaurants, Canadian (New)"
264,APSqjYlmUOGbrmP5DH7yrw,rN3XnPL0hqE-7qBUfAbCTg,0,0,0,"The appetizer we had are the heirloom tomatoes, basil and cheese  & calamari both are great!  

The hot bread and butter is amazing.  Don't over indulge you wont have room for your entree.

""Prime rib & half lobster with veggies"". You cannot go wrong delish!

""Peppercorn steak and 2x baked potato with veggies"". Another great meal.  Salad was great!

$5 mix drinks",The Keg Steakhouse + Bar - Pointe-Claire,6815 Autoroute Transcanadienne F017,Pointe-Claire,QC,Pointe-ClaireQC,H9R 1C4,45.4640803605,-73.8300067602,4.0,47,"Bars, Nightlife, Seafood, Steakhouses, Restaurants, Canadian (New)"
265,LlrjVRybqzD7DW2JmE6Znw,rN3XnPL0hqE-7qBUfAbCTg,0,0,1,"Visited Pointe Claire recently for work at a major aviation manufacturer.  Searched for the best restaurants in the area and consistently the Keg was rated the highest with the best reviews.   My research was strengthened when work colleagues gave a glowing review of having gone the previous night.  They raved about the service and food and they were right.  

The Keg was convenient to our hotel and we lucked out with good parking. We worried as everyone told us we needed a reservation but we just beat the rush and were able to walk in with no worry. 

Having been our first visit to this popular Canadian chain, we put heavy stock in the recommendations of their servers. Our server was perfect, honest and gave really great menu advice. 

I went with the Sirloin Oscar. It's an 8oz sirloin cut served with shrimp, scallops, asparagus, and Béarnaise sauce, at ($37 CDN / October 2018).  Pricey yes, but a great portion and worth every penny.  

We enjoyed a great Cabernet, and a small sample of their mini desserts.  

The restaurant was extremely busy and filled up with a long wait after we were seated.  It was a mix of business groups holding 30-person events and many many birthdays.  It seemed as if everyone was walking in with flowers and gifts to celebrate at this special place. 

Huge thanks to all the hostesses, servers, managers and heart of the house cook staff that made our first visit a very special one where we can't wait to return. 

It's so hard to believe that a chain can provide such quality experience, products and services and be consistent.  Having finally visited I'm now not surprised at this brand's popularity.   Really wish chains in the states could emulate their success. Every chain restaurant here focuses on being cheap and ripping off the customer.",The Keg Steakhouse + Bar - Pointe-Claire,6815 Autoroute Transcanadienne F017,Pointe-Claire,QC,Pointe-ClaireQC,H9R 1C4,45.4640803605,-73.8300067602,4.0,47,"Bars, Nightlife, Seafood, Steakhouses, Restaurants, Canadian (New)"
266,MtDA12icBNXs6CG9VzU3xQ,rN3XnPL0hqE-7qBUfAbCTg,0,0,0,"Fantastic food, service and atmosphere. If you want steak, this is the place to eat it. Well worth it!!",The Keg Steakhouse + Bar - Pointe-Claire,6815 Autoroute Transcanadienne F017,Pointe-Claire,QC,Pointe-ClaireQC,H9R 1C4,45.4640803605,-73.8300067602,4.0,47,"Bars, Nightlife, Seafood, Steakhouses, Restaurants, Canadian (New)"
267,sdOr13fW6g1FhMr89Xn8cw,rN3XnPL0hqE-7qBUfAbCTg,2,0,0,"Food and drinks were awesome as usual.  Only issue I had was when bartender ordered the waitress to clean the glasses...and then proceeded to complain to Manager about issue...all in front of me and my friend.  Honestly, not a cheap place to visit - I don't really want staff's issues discussed while I am trying to enjoy myself.  I was not impressed with this and hope she learns to be careful when and where to be bossy and try to score points with the Manager.",The Keg Steakhouse + Bar - Pointe-Claire,6815 Autoroute Transcanadienne F017,Pointe-Claire,QC,Pointe-ClaireQC,H9R 1C4,45.4640803605,-73.8300067602,4.0,47,"Bars, Nightlife, Seafood, Steakhouses, Restaurants, Canadian (New)"
268,ML6OjLss49gobIpdnXx1xQ,rN3XnPL0hqE-7qBUfAbCTg,2,0,0,"My first time here could not have went better.

But here I am, my second time around at the Keg.
I must say that it was on a saturday night at 6pm.
We were 5 people waiting for a table in the dining room.
 They told us it would take about 90 min.
Nothing wrong with that, don't mind waiting for a table while drinking at their beautiful bar.
But the people I was with accepted a table at the bar instead, being that the wait would be 10 min. instead of 90...

Things were looking up when they offered us a table in the dining room because someone else preferred to be in the bar to watch the game,  even better!

But after 45 min of waiting and all these promises,  here comes the same guy telling us now that it was all a mistake on his part, that we couldn't be seated in the dining room area!?
So the table we initially had accepted at the bar was gone and so as the other one in the dining room! 

So he offers us a round of drinks and appetizers. 
And promises us the next bar table available. 

What a fiasco!

Fridays and Saturdays are quite complicated days to get a table here.
I think you need to reserve before 6pm, otherwise, good luck!

The booth tables at the back of the bar are not meant to have a full dinner on, way too small, very akward and annoying for everyone. 
Can't fit much on there, especially if we all have drinks and water (which apparently you need to ask for, the days of bringing water all around seem to be gone, here)

Not a good experience,  especially when you end up paying over $400 to get under cooked vegetables,  watered-down drinks, tough fillet mignon,  and a seating fiasco to boot!

Pretty but not well orchestrated.",The Keg Steakhouse + Bar - Pointe-Claire,6815 Autoroute Transcanadienne F017,Pointe-Claire,QC,Pointe-ClaireQC,H9R 1C4,45.4640803605,-73.8300067602,4.0,47,"Bars, Nightlife, Seafood, Steakhouses, Restaurants, Canadian (New)"
269,sdPIpY47BHV1HpYnv9sZpA,rN3XnPL0hqE-7qBUfAbCTg,5,1,0,"Short and to the point...
The Keg serves up delicious food, all at a reasonable price considering the portion sizes. Add amazing service and this place is definitely a go-to. You can chose between the louder, more business-casual bar area or the regular dining area for a quieter evening. There is also an upstairs, which I think is for larger groups. There is something for everyone!

Quick story... I ordered the rib steak, medium rare. It came more towards medium. The waiter noticed, without even being prompted and offered to replace it. The steak was still excellent, so I declined the offer. Instead, to our surprise, the waiter brought us a huge piece of mocha ice cream cake for dessert, as an apology for the inconvenience. That is a defining feature of a 5 star restaurant.",The Keg Steakhouse + Bar - Pointe-Claire,6815 Autoroute Transcanadienne F017,Pointe-Claire,QC,Pointe-ClaireQC,H9R 1C4,45.4640803605,-73.8300067602,4.0,47,"Bars, Nightlife, Seafood, Steakhouses, Restaurants, Canadian (New)"
270,WFILioiuhTD0k1Ibf2m0dA,rN3XnPL0hqE-7qBUfAbCTg,1,0,0,"Received a Keg gift card so we decided to drive to Pointe Claire for a nice dinner.  Unfortunately I neglected to make a reservation - forgetting it was a weekend and would most likely be busy.  Got lost on the south side of the Trans Canada not realizing it was located in the Fairview Shopping Centre area.  My mistake for not calling ahead.  After searching for a parking spot not too far away (it was freezing out) we entered the restaurant to find there would be a 2 hour wait for a table.  Unless we opted to stand at the crowded bar, have a drink and put our name on a wait list.  This was fine with me - but my partner wasn't too happy; he usually dislikes waiting longer than 5 minutes for anything.  We ordered drinks - a very enjoyable merlot wine for me and a beer for him.  Not sure how long we waited for a table, but our attentive girl with our name on her list found us and brought us to a cosy little nook table in the bar area.  We were served by Zoe who helped us figure out the menu and was most attentive.  We had the scallops and bacon for appetizer - which was fabulous.  I ordered the sirloin steak with baked potato and mix green salad; everything was delicious.  My partner had the ribs which he said were also very good.  All in all the evening turned out pretty good but even with the gift card was quite expensive for us.",The Keg Steakhouse + Bar - Pointe-Claire,6815 Autoroute Transcanadienne F017,Pointe-Claire,QC,Pointe-ClaireQC,H9R 1C4,45.4640803605,-73.8300067602,4.0,47,"Bars, Nightlife, Seafood, Steakhouses, Restaurants, Canadian (New)"
271,eSUWzYZ1egWgrMYutVQ9Zg,rN3XnPL0hqE-7qBUfAbCTg,1,0,0,"This is my favorite restaurant in the area. The steak is great, lobster is great and give the King Crab a try, its delicious. The kids meals come with their very own appetiser plate which they always look forward to and the kids meals are reasonably priced. 

I cannot complete this review without mentioning how amazing the service is - every time. I have been 10 times in 2017 and the service is always outstanding and keeps me coming back. Highly recommend a date night or family night here.",The Keg Steakhouse + Bar - Pointe-Claire,6815 Autoroute Transcanadienne F017,Pointe-Claire,QC,Pointe-ClaireQC,H9R 1C4,45.4640803605,-73.8300067602,4.0,47,"Bars, Nightlife, Seafood, Steakhouses, Restaurants, Canadian (New)"
272,TzLqsDcRZquX7nTMN0DydQ,rN3XnPL0hqE-7qBUfAbCTg,0,0,0,"Excellent food and service. The steak is tender and juicy. We had a good time here. I recommend the rib steak the most. Since my aunt doesn't eat rare steak, we ordered medium cooked rib steak under the recommendations. It seems that this cut will allow the steak to be cooked more without being tough inside. Overall, it was a great experience and I will definitely come back again.",The Keg Steakhouse + Bar - Pointe-Claire,6815 Autoroute Transcanadienne F017,Pointe-Claire,QC,Pointe-ClaireQC,H9R 1C4,45.4640803605,-73.8300067602,4.0,47,"Bars, Nightlife, Seafood, Steakhouses, Restaurants, Canadian (New)"
273,jhsP6EIbsx6_zq2n5oPDsw,rN3XnPL0hqE-7qBUfAbCTg,1,0,1,"My manager and I were in town for business and decided to go to The Keg for dinner since it was near our hotel. It was a Wednesday night and surprisingly, pretty crowded. We put our names on the waitlist and waited for about 10 minutes or so and then were seated. 

The server was great, very friendly and knowledgeable. She mentioned that she was from the US, so we all bonded over that briefly. We had drinks/wine and ordered our entrees. We ordered the tuna tartare and calamari as appetizers, and both were absolutely delicious! I ordered the 7 oz. filet mignon, which was bacon-wrapped, and the twice-baked potato and a Caesar salad for my main course. Y'all...this was the best filet I've ever had! The bacon really gave it good flavor although I didn't eat the actual bacon, and the potato and salad were equally good. The sautéed mushrooms, peppers, and green beans that came with the meal were also really good.

This was an amazing dining experience from the food to the service to the ambience. If I'm ever in the area again, I'll be sure to visit!",The Keg Steakhouse + Bar - Pointe-Claire,6815 Autoroute Transcanadienne F017,Pointe-Claire,QC,Pointe-ClaireQC,H9R 1C4,45.4640803605,-73.8300067602,4.0,47,"Bars, Nightlife, Seafood, Steakhouses, Restaurants, Canadian (New)"
274,pgjKFCyxidobjawaAa5OUA,rN3XnPL0hqE-7qBUfAbCTg,0,0,0,Took my boyfriend who is from Montreal to The Keg for his 24th birthday. ABSOLUTELY LOVED the food! AMAZING! Will 100% be begging to come back here the next time I visit Montreal( I am from the states and we need The Keg there). Kelly was also an amazing sever!,The Keg Steakhouse + Bar - Pointe-Claire,6815 Autoroute Transcanadienne F017,Pointe-Claire,QC,Pointe-ClaireQC,H9R 1C4,45.4640803605,-73.8300067602,4.0,47,"Bars, Nightlife, Seafood, Steakhouses, Restaurants, Canadian (New)"
275,N9U3-oriOrXNCFzdDbx-Ig,wfO69JUp-H8kbm3dn0zcnA,0,0,0,We decided to try it out and was pleasantly surprised. The dipped vanilla cone was amazing! Dipped in Belgium chocolate. The decor is a surf theme which makes it unique and fun. It's a must try if you live in the west.,Hawaii Ice,123 Avenue Donegani,Pointe-Claire,QC,Pointe-ClaireQC,H9R 2W3,45.4501568,-73.7914574,5.0,3,"Ice Cream & Frozen Yogurt, Coffee & Tea, Food"
276,YvabVba4m5Rd5veXyLOUrQ,wfO69JUp-H8kbm3dn0zcnA,0,0,0,"If you're hooked on smoooooth ice, you've gotta try this! I'm a big fan of blender drinks, but the crushed ice in those has nothing on the velvety texture of this shave-ice miracle. Spoon or a straw?",Hawaii Ice,123 Avenue Donegani,Pointe-Claire,QC,Pointe-ClaireQC,H9R 2W3,45.4501568,-73.7914574,5.0,3,"Ice Cream & Frozen Yogurt, Coffee & Tea, Food"
277,wtr9rvM-tMjpfAnCyyo00A,wfO69JUp-H8kbm3dn0zcnA,0,0,0,"I agree with the previous review - you gotta come here if you live in the West.  

Breakaway from the ice cream routine and bask in the goodness of shaved ice.  You choose your own flavour(s) and you can even order a rainbow!  Your lips will be tinted by the syrup, but, that's the fun part :).  My fave part about my visits here is the owner shares his stories with us as to how he came to opening this place and it's a lovely story.  He greats us and says goodbye with ""Mahalo"" everytime.  Makes me smile all the time.

And by the way, no calories :D.",Hawaii Ice,123 Avenue Donegani,Pointe-Claire,QC,Pointe-ClaireQC,H9R 2W3,45.4501568,-73.7914574,5.0,3,"Ice Cream & Frozen Yogurt, Coffee & Tea, Food"
