,review_id,business_id,useful,funny,cool,text,name,address,city,state,city||state,postal_code,latitude,longitude,stars,review_count,categories
515,51ss4tljbOJVOo--wSNQOQ,0I0mXzLz6rPKXH9Ot6Po7g,1,0,0,"I have breakfast there often..Food is great..eggs toast and coffee .place is  modern and clean including washrooms...sevice is friendly and efficient...prices are reasonable,,,generous refills on coffee...and the coffee is fresh
guess this is why I keep going back...",Le Quartier du Dejeuner,1858C Boul des Sources,Pointe-Claire,QC,Pointe-ClaireQC,H9R 5B1,45.4648209,-73.785739,4.0,18,"Breakfast & Brunch, Restaurants"
516,EzFhUN0F_OzxF61YM93bFA,0I0mXzLz6rPKXH9Ot6Po7g,0,0,0,Great service and great eggs Benedict accompanied with a generous fresh bowl of fruit. Very good experience!,Le Quartier du Dejeuner,1858C Boul des Sources,Pointe-Claire,QC,Pointe-ClaireQC,H9R 5B1,45.4648209,-73.785739,4.0,18,"Breakfast & Brunch, Restaurants"
517,S0swaga5sCtnz3P9uexKCg,0I0mXzLz6rPKXH9Ot6Po7g,2,0,1,"It was my first time at this breakfast place.
Nice decor, lots of seating.
It's apparently very popular with the before work crowd as it was quite busy at 7:30 on a Friday morning.
I found the food the same as pretty much every other breakfast place,  but  the prices area lot higher than the breakfast places I generally go to. Service was ok.",Le Quartier du Dejeuner,1858C Boul des Sources,Pointe-Claire,QC,Pointe-ClaireQC,H9R 5B1,45.4648209,-73.785739,4.0,18,"Breakfast & Brunch, Restaurants"
518,XLnMC8cSdh5FSdCYuI34GA,0I0mXzLz6rPKXH9Ot6Po7g,1,1,1,"Came here on tour, and the combo plates were GREAT! Nice room, great options, food was stellar.",Le Quartier du Dejeuner,1858C Boul des Sources,Pointe-Claire,QC,Pointe-ClaireQC,H9R 5B1,45.4648209,-73.785739,4.0,18,"Breakfast & Brunch, Restaurants"
519,z16HrP1mN3T9q8EJRykrgQ,0I0mXzLz6rPKXH9Ot6Po7g,1,0,1,"Great food and big portions,friendly staff. Not too noisy or overcrowded like the other west island bfast joints. Love the fresh & perfectly ripe fruit. Had the Florentine great hollandaise, right consistency and perfectly cooked poached egg. Will be back for sure. Highly recommend for those west island brunchers looking for something new and delicious.",Le Quartier du Dejeuner,1858C Boul des Sources,Pointe-Claire,QC,Pointe-ClaireQC,H9R 5B1,45.4648209,-73.785739,4.0,18,"Breakfast & Brunch, Restaurants"
520,ba1_hr6T_pFwd6uJsWaoOA,0I0mXzLz6rPKXH9Ot6Po7g,2,0,0,"Great Breakfast/Brunch Restaurant in Pointe Claire

My wife and I recently discovered this wonderful breakfast restaurant.  A friend had mentioned it and we decide to give it a try.  We have visited a total of three times now, and will definitely be making it a regular stop.

Each visit I have tried to order something different, and to date I have not been disappointed.  The portions are generous, and the meals have always been cooked to perfection.  The staff are always smiling and friendly.

Even when it got busy we were able to carry on our conversations with no problem.  The décor is charming, and clean.  A great place for breakfast or brunch.",Le Quartier du Dejeuner,1858C Boul des Sources,Pointe-Claire,QC,Pointe-ClaireQC,H9R 5B1,45.4648209,-73.785739,4.0,18,"Breakfast & Brunch, Restaurants"
521,mMQTubsUxkveTE0tTH_M-Q,0I0mXzLz6rPKXH9Ot6Po7g,1,0,0,"Another great west island breakfast spot!
Quick service, good food and lots of choices.",Le Quartier du Dejeuner,1858C Boul des Sources,Pointe-Claire,QC,Pointe-ClaireQC,H9R 5B1,45.4648209,-73.785739,4.0,18,"Breakfast & Brunch, Restaurants"
522,0FbmXz55rqI54-d0IG9aHQ,0I0mXzLz6rPKXH9Ot6Po7g,1,0,0,"Amazing brunch and breakfast options!!

They have great options and even many combos named after what's popular in different cities! It's really
Cool!

I got the Las Vegas with flavored pancakes! Amazing! 

The eggs were really great as well! 

Portions are HUGE and the food is outstanding!!!!!

I would definitely be back!!",Le Quartier du Dejeuner,1858C Boul des Sources,Pointe-Claire,QC,Pointe-ClaireQC,H9R 5B1,45.4648209,-73.785739,4.0,18,"Breakfast & Brunch, Restaurants"
523,Y0RRaYv4JtfAf-y9Ts7Qhw,0I0mXzLz6rPKXH9Ot6Po7g,1,0,1,"Wonderful place, excellent food. Stopped after flying in on a red eye.  I ordered the smoked meat omelette with Swiss. The homefries were nice and crispy and the homemade toast is excellent. 

The day I was here our server was not very attentive to our needs. Had to ask for coffee and water refills a few times. Not too busy but maybe he was alone this day. I'd totally come back if I'm in the area again.",Le Quartier du Dejeuner,1858C Boul des Sources,Pointe-Claire,QC,Pointe-ClaireQC,H9R 5B1,45.4648209,-73.785739,4.0,18,"Breakfast & Brunch, Restaurants"
524,7LvBM3C3wMF9vpZBqseyXg,0I0mXzLz6rPKXH9Ot6Po7g,20,14,19,"Absolutely adored this spot. Would definitely come again for brunch. Excellent, abundant options, excellent service, excellent atmosphere. I would be tempted to give a full 5 stars, but I hafta remove a star for a coupla unfortunate isssues. Though I still definitely recommend going out of your way to check this out. 

Came for brunch with a gf of mine (Chris), we wanted a place more near her place but still a decent brunch option. We had Bistro Nolah in our minds, but they were unfortunately just opening back up after summer vacation only for supper service the day we wanted. So a quick Yelp search through my bookmark collection for Brunch led us here and thanks to the recommendations of my fellow Yelpers: we were not disappointed in having to second choice this spot. 

We both chose Benedictins (not likely to make it ourselves at home), expensive at 15-18$ per plate but soooooooo worth it. 

She took the Canadian if memory serves, and I chose the Californian : bacon AND avocado AND cheese?? Yes. Fkin. Please. Unfortunately Hollandaise sauce was slightly too watery, not quite as creamy as I like; and bright yellow, like NEON ...what is up w that? It tasted alright though, so fine. Then the avocado was wayyy too underripe, soooo sad :( :( . This is where I must remove stars, don't offer me avocado if it's hard and tasteless: I don't want it and I certainly don't want to pay more for it. Then the bacon was slightly too crispy too, but now I'm being picky. 

Incredible portions though. And that fruit bowl that accompanies each and every single plate?! Omg sooooooo worth it! Best fruit bowl ever! It's not an after thought here, they take pride in the fruit offering and it so shows! The potatoes that accompany the plates are deeeeelicious too! Crispy outside fluffy inside, no salt or sauce needed, but indulge if you so prefer. 

The coffee was decent, not great, not terrible and refilled fairly frequently so that's a plus! 

The decor was calm and soothing and still very kool. My friend found it amusing there was a Stonewall photograph, she explained the story behind it (Stonewall riots https://g.co/kgs/jrfgBN ) and was happy to see it as a sign of acceptance to all. Among other beautiful worldly photographs of various sizes, all black and whites, which adorn the walls. 

We had a lovely time, service lagged a bit at the end and we had to pack our own to-go containers (note to future self: really start remembering to bring tupperware), but our waitress was super sweet, friendly and just lovely, so I really can't complain. 

Would go again in a heart beat!",Le Quartier du Dejeuner,1858C Boul des Sources,Pointe-Claire,QC,Pointe-ClaireQC,H9R 5B1,45.4648209,-73.785739,4.0,18,"Breakfast & Brunch, Restaurants"
525,4YOu79HqZaHMuHPQwY6Hdw,lx4vVJndLJjRmZKQNIaXpA,1,0,0,"Okay I'm glad to be the first reviewer. ..(Seems like there is a good set of reviews under another name Sushi Saint Jean vs Sushi St Jean)

I went to this place after seeing the sign through the kanda sushi window while having dinner at Kanda.

Place is new, medium size ....great decor and modern, may be its brand new...also caters for all group size..2-6. Also saw a section on the side for large group.

Went with my gf for dinner on a friday eve. This is an all you can eat place

The lady at the door have an attitude and not so friendly, seems like all the female staff have some sort of an attitude issue... on the other hand all the male staff are very friendly and helpful.

Each table will get a galaxy tablet to order. Unfortunately the lady waitress didn't bother explaining anything and she just left the tab at the table and walked away...so we assumed all and ordered...the male staff were happy to answer our questions..While ordering u can see the picture of the sushi and its content.. once u submit ur order one waiter will bring a print out of ur order to ur table.

So when waiter brings your food, they cross the print out to make sure u received ur order. That also helps me, majority of the time all these all u can eat places we were not sure if we got all the food and also if we got the right food. This also helped me here, the waitress showed up at my table with sushi even though i got mine and it was crossed, she showed up crossed on top of it....and i have to tell her hey listen i already got this and its crossed. seems like she wanna push her leftovers on to us...

Also noticed that they put reserve signs for all the booth to pack the first comers and save the booth for late comers. Even though we showed up at 830pm. And we stayed until 9:45-10:0 and majority of the booths were not taken.

Quality of sushi is good compared to other ""all you can eat"" places in west island. Enough variety compared to other places, Its taste fresh.

A good place to enjoy sushi and will definitely go back, (will ignore the female staff ) just because the quality of the food.  Price to quality and value its good.

Will definitely go back and recommend to all sushi lovers

PT",Sushi St-Jean,1000 Boulevard Saint-jean,Pointe-Claire,QC,Pointe-ClaireQC,H9R 5P1,45.4698222137,-73.8321464616,2.5,60,"Japanese, Restaurants, Sushi Bars"
526,o-d2-encEHjUATiFYdrYEQ,lx4vVJndLJjRmZKQNIaXpA,2,0,1,"I went to this place after seeing the sign through the kanda sushi window while having dinner at Kanda.

Place is new, medium size ....great decor and modern, may be its brand new...also caters for all group size..2-6. Also saw a section on the side for large group.

Went with my gf for dinner on a friday eve. This is an all you can eat place

The lady at the door have an attitude and not so friendly, seems like all the female staff have some sort of an attitude issue... on the other hand all the male staff are very friendly and helpful.

Each table will get a galaxy tablet to order. Unfortunately the lady waitress didn't bother explaining anything and she just left the tab at the table and walked away...so we assumed all and ordered...the male staff were happy to answer our questions..While ordering u can see the picture of the sushi and its content.. once u submit ur order one waiter will bring a print out of ur order to ur table.


So when waiter brings your food, they cross the print out to make sure u received ur order. That also helps me, majority of the time all these all u can eat places we were not sure if we got all the food and also if we got the right food. This also helped me here, the waitress showed up at my table with sushi even though i got mine and it was crossed, she showed up crossed on top of it....and i have to tell her hey listen i already got this and its crossed. seems like she wanna push her leftovers on to us...

Also noticed that they put reserve signs for all the booth to pack the first comers and save the booth for late comers. Even though we showed up at 830pm. And we stayed until 9:45-10:0 and majority of the booths were not taken.

Quality of sushi is good compared to other ""all you can eat"" places in west island. Enough variety compared to other places, Its taste fresh.

A good place to enjoy sushi and will definitely go back, (will ignore the female staff ) just because the quality of the food.  Price to quality and value its good.

Will definitely go back and recommend to all sushi lovers

PT",Sushi St-Jean,1000 Boulevard Saint-jean,Pointe-Claire,QC,Pointe-ClaireQC,H9R 5P1,45.4698222137,-73.8321464616,2.5,60,"Japanese, Restaurants, Sushi Bars"
527,nifOPHlUiMAtYxh7-qGpzQ,lx4vVJndLJjRmZKQNIaXpA,1,0,0,"The only reason you go to an all you can eat sushi restaurant is to order as much of everything as possible. Bearing that in mind, it is impossible to expect any real quality sushi (or anything). 

The fish used might be fresh, but their sushi are bland and stale. The sautéed meet dishes were fine but only because they were saucy and salty (much like general tso chicken at an AYCE Chinese). The same goes for the majority of their menu items. 

I rarely criticize service as there is usually a minimum to ensure a healthy restaurant experience. The service here is well below the minimum! On all three occasions (which, for the record, I was brought back against my will), service was horrible. I can forgive a server for mixing up orders and making mistakes as we are only human, but no paying customer should ever have to experience the sort of attitude received here. 

Tipping. It is usually a straight forward process: 15% if satisfied; more if amazing; less if dissatisfied, and servers leave you to your decision. Not here. God help you if you tip a penny less than 15%. I have seen servers argue for their dues, even attempt to overcharge/ keep the change for tip. For some reason I remember them including a service tax for some time and still requiring you to pay a 15% tip.

In sum, if you have to eat here you should do so during the lunch time special. The $30+ for dinner (after 14h00) is just too expensive for what you get.

Pro tip: for the same price you can eat to your fill at an à-la-carte sushi restaurant: i.e. Tokyo Trésor, Soho, etc.",Sushi St-Jean,1000 Boulevard Saint-jean,Pointe-Claire,QC,Pointe-ClaireQC,H9R 5P1,45.4698222137,-73.8321464616,2.5,60,"Japanese, Restaurants, Sushi Bars"
528,PEu_YaqtiuBZVU762eSiaQ,lx4vVJndLJjRmZKQNIaXpA,1,0,0,Just no. Warm rice cold sushi- ick. Horrible service and mediocre food. Had to ask for forgotten items twice after ordering it twice. Soup came in middle of meal and was very salty. Don't bother.,Sushi St-Jean,1000 Boulevard Saint-jean,Pointe-Claire,QC,Pointe-ClaireQC,H9R 5P1,45.4698222137,-73.8321464616,2.5,60,"Japanese, Restaurants, Sushi Bars"
529,fMWT5W4sDbhUUb-T-rE4bQ,lx4vVJndLJjRmZKQNIaXpA,0,0,0,"The sushi is average. The service is pretty decent. You get a receipt with every order so you can keep track of what you ordered. The upside is that you get soft drinks too, which are included.",Sushi St-Jean,1000 Boulevard Saint-jean,Pointe-Claire,QC,Pointe-ClaireQC,H9R 5P1,45.4698222137,-73.8321464616,2.5,60,"Japanese, Restaurants, Sushi Bars"
530,LVoiAY2915eV_ypau7gdUw,lx4vVJndLJjRmZKQNIaXpA,2,0,0,"I use to go to this restaurant maybe once or twice a month which is quite a few times. The service is great. Staff is very quite and just tend to do they're job but it would've been nice to speak a little bit. The sushi is excellent. I haven't tried everything on the menu but I haven't tasted anything yet that I disliked. 

The reason why I am giving 2 stars out of 5 is because last time I went, which wasn't long ago, I was with my boyfriend and him and I got food poisoning. At first I thought maybe it's just me but when I ask my boyfriend he told me he's having the same symptoms.


Although this was my favourite sushi restaurant, i don't think I will be visiting it anymore and if I do, I won't get anything with fish which is not really a great experiment if your eating sushi!",Sushi St-Jean,1000 Boulevard Saint-jean,Pointe-Claire,QC,Pointe-ClaireQC,H9R 5P1,45.4698222137,-73.8321464616,2.5,60,"Japanese, Restaurants, Sushi Bars"
531,X2h-blYHKBthc4K3LGPN7w,lx4vVJndLJjRmZKQNIaXpA,0,0,0,"The sushi was so fresh and so yum ,, we went lunch hour we had to wait in line because it was so busy make reservations before you go to get seated faster,, you order from your tablet,,, salmon is super fresh melts in your mouth ,,, crabs were super yumm and fresh ,, love it differently going back,, we usually order on the phone but to sit there and eat is way better",Sushi St-Jean,1000 Boulevard Saint-jean,Pointe-Claire,QC,Pointe-ClaireQC,H9R 5P1,45.4698222137,-73.8321464616,2.5,60,"Japanese, Restaurants, Sushi Bars"
532,zb4zfssnVwv8Le8DvdNj2w,lx4vVJndLJjRmZKQNIaXpA,1,0,0,"Strongly not recommended if you are thinking about going in big groups. We had a reservation at 7:30 for 12 people and were seated fairly quickly. However, what ensues was just bad. Since we were a large group, we made a large order. Typically, these all-you-can-eat places rarely honour your whole order, so we ordered more on top of it expecting half our order not showing up. What we had was consistently 25% of our order come. Up until their last service, some of the people at our table were still hungry.

As per the food, it is your run off the mill ayce sushi place, with subpar sushi and sashimi. It's fine if you want a quick fix of sushi, but nothing extraordinary.

Overall, if you crave and starve for sushi, I guess this place is fine, but make sure to be 4 or less if you want to get your food.",Sushi St-Jean,1000 Boulevard Saint-jean,Pointe-Claire,QC,Pointe-ClaireQC,H9R 5P1,45.4698222137,-73.8321464616,2.5,60,"Japanese, Restaurants, Sushi Bars"
533,nTDREBuC49GI6cEEulWwlQ,lx4vVJndLJjRmZKQNIaXpA,1,0,0,"SOOO GOOD! This place is just the best all you can eat sushi place ive ever been. 
Good quality? Yes.
Service? Sooo quick.
Convenient? Yesss- You order from tablets, and just order whatever you want. And the food comes really quick.

There was just a bit of a lineup, but we didnt even wait that long. The food quality is pretty good compared to other all you can eat sushi places. I would definitely come back here, only if it was closer to downtown.",Sushi St-Jean,1000 Boulevard Saint-jean,Pointe-Claire,QC,Pointe-ClaireQC,H9R 5P1,45.4698222137,-73.8321464616,2.5,60,"Japanese, Restaurants, Sushi Bars"
534,R1d4_Uw30uGPfYQZP1q-zg,lx4vVJndLJjRmZKQNIaXpA,1,0,0,Horrible service. Staff were slow and rude. The food was horrible. Everything tasted the same. Everything tastes deep fried and greasy with no distinguished flavours. Your better off going to kanda sushi.,Sushi St-Jean,1000 Boulevard Saint-jean,Pointe-Claire,QC,Pointe-ClaireQC,H9R 5P1,45.4698222137,-73.8321464616,2.5,60,"Japanese, Restaurants, Sushi Bars"
535,jln3GrUE7BM_eqI56IJXnw,lx4vVJndLJjRmZKQNIaXpA,4,1,0,"The food is really good, but the service is absolutely terrible.

Let me start with the food before I explain the service. The fish is fresh, and doesn't have that weird waxy texture you experience sometimes. The temperature is also good, not cold. The selection is also excellent, far better that Kanda across the street. This aspect is actually pretty close to perfect for an all you can eat. Unfortunately, we don go to a restaurant only for the food, but the service as well. That's were the story is:

We were a group of 4, for supper on a Thursday night. It was quite busy, all the tables were full.

We started off the evening with a very quick request for our order, even before we had a chance to see the menu at length and before our whole party had arrived. Normally, this takes the longest, so we were happy that it looked like the service would be nice and prompt.

My friend and I ordered the sushi pizza and some teriyaki chicken while we waited for the other 2 people to show up. It took almost 15 minutes for that order to arrive, by which point we had prepared our second order after the party was complete.

That order took close to 20 minutes to arrive, and we placed our third order. This is where everything went downhill.

We waited and waited, and were delivered sushi pizza again, despite not remembering ordering it. Alright, we were hungry, having waited over 10 minutes at that point at an empty table. Then we saw what looked like our order delivered to a table next to us. The people at that table seemed confused, but they didn't really argue and took a large plate with over 40 pieces on it. Then, we got another sushi pizza. This was a bit of a surprise, but hey, we were hungry... We asked the waited to look into our order, and he couldn't find it anymore. So we made another one.

Then I witnessed something that had our table in tears we were laughing so hard, because a table behind us received an order of sushi pizza, and they had the most perplexed look on their face as the waiter served it to them. They had clearly not ordered it. But they took the plate anyways.

Finally, 35 minutes after we had finished the second order, and two sushi pizzas we didn't order arrived, we got half of the third order. At this point we were fed up, but still hungry, so we placed a 4th and final order.

The second half of the third order never showed up, but we got half of the 4th order.

All in all, we spent 2 hours and 15 minutes at the restaurant, and had food on our table for about 30 minutes of that.

I'm returning today and hope the service is better when they aren't as busy. I will report back to be sure.",Sushi St-Jean,1000 Boulevard Saint-jean,Pointe-Claire,QC,Pointe-ClaireQC,H9R 5P1,45.4698222137,-73.8321464616,2.5,60,"Japanese, Restaurants, Sushi Bars"
536,z4p0gF1E6SfujeS0de5jBA,lx4vVJndLJjRmZKQNIaXpA,0,1,0,"I was torn between 2 or 3 stars to be honest. Three. Would have been generous as the food is pretty much meh overall. It's a confusing way to order, the fast service is great unless you plan to have a nice  dinner as well. Let me explain..sit down, here's a table and they walk away. Sure, we will figure that out - no problem. Hit the order button.  Food comes randomly. Appetizers last, some sushi now, some cooked food later, etc...  Brought by life 5 people and no one even points out which is what.  Just eat.  Done?  Let's reset that tablet so you can order more.  Rinse, lather, repeat. Quality is ok not great but what stunk it up for me was the rapid fire service that disallowed a nice evening and for $30/person?  Excuse me but I'll just head to a ""real"" nice restaurant and get some actual service from it as well.",Sushi St-Jean,1000 Boulevard Saint-jean,Pointe-Claire,QC,Pointe-ClaireQC,H9R 5P1,45.4698222137,-73.8321464616,2.5,60,"Japanese, Restaurants, Sushi Bars"
537,Tpg8y54potmJmPTwvfjbSg,lx4vVJndLJjRmZKQNIaXpA,1,0,1,"It's interesting how Sushi St. Jean opened their restaurant right across the street from Kanda, another all you can eat sushi bar. It might have been annoying if Sushi St. J didn't sling sushi so much better than Kanda.

PROs
- Ordering off a tablet (you can see each item, no waiting to order, best thing ever)
- Service is FAST (instead of bringing everything at once, waiters will keep coming back with plates and check them off a list)
- Staff is friendly (IMO a rarity when service is unconventional)
- Sushi is tasty (all of this would count for nothing if the product wasn't good)
- Large variety (I don't know how they manage from a operations standpoint)

CONs
- Pricey (Despite a totally justified price, there are cheaper places to get a sushi dinner)
- Last call on orders is an hour before closing (Justified and obvious but still a point worth mentioning)",Sushi St-Jean,1000 Boulevard Saint-jean,Pointe-Claire,QC,Pointe-ClaireQC,H9R 5P1,45.4698222137,-73.8321464616,2.5,60,"Japanese, Restaurants, Sushi Bars"
538,_1BQxdF1HgZNhEE4tALs7Q,lx4vVJndLJjRmZKQNIaXpA,1,0,0,"ATMOSPHERE: It's a nice restaurant with a modern touch. Classic look for this sushi chain.

FOOD: The sushis are ok, they aren't the best and don't taste the freshest. Also, they put way too much rice in their sushi (which I'm sure is to fill you up as fast as possible). However, their hot foods are pretty good! And I like the fact that they offer takoyakis (fried octopus balls) at dinner. Overall, food is decent, not the best place to go though.

PRICE: Standard prices for lunch and dinner for an all-you-can-eat sushi spot.

SERVICE: Service isn't the best. Before they changed management, service was terrible. But nowadays, it has gotten better. They aren't the friendliest but they are very efficient.",Sushi St-Jean,1000 Boulevard Saint-jean,Pointe-Claire,QC,Pointe-ClaireQC,H9R 5P1,45.4698222137,-73.8321464616,2.5,60,"Japanese, Restaurants, Sushi Bars"
