,review_id,business_id,useful,funny,cool,text,name,address,city,state,city||state,postal_code,latitude,longitude,stars,review_count,categories
797,V0gmPH6H1UWc2KJYZtKRpg,dj2KhjtZBC3Y1IrAsDXYng,10,10,10,"You know that it's an old building when the top of the door frame hits you at about the eyebrows. I'm tall, but not THAT tall. It turned out the building was indeed old - built in 1847 from local stone; it served as residences for multiple families over the years; even a blacksmith shop. A hundred years later it finally became a restaurant in the picturesque lakeside town of Pointe-Claire.

We were here for our final work dinner after a somewhat-grueling business trip; and the smaller group and surroundings made this a more cozy, intimate affair than previous dinners. We were led to our own space in the upstairs area, near a crackling fireplace, where we proceeded to order cocktails. (They had a local stout on the menu, so I had to get that first).

The menu was small but excellent (the best kind). i was momentarily torn, but in about 30 seconds the decision was easy: they had venison; which is always a no-brainer for me.

-- Red Deer in mushroom sauce: Fantastic; and probably the best venison dish I've ever had.  It was not only tender; but lean and flavorful. Not gamey (even though I'm usually OK with a little). It was served over delicious potatoes with a side of perfect green beans. I actually felt sorry for some of my compatriots, who ordered something else. They liked their dishes, but were not as thrilled as I.

Then came dessert. i had actually eaten so well during the week (with little exercise) that I declined, despite the great choices (creme brûlée, apple tart, profiterole, chocolate torte, etc). I ordered a nice glass or port and a coffee instead and enjoyed the oohs, aahs and spirited conversation with my co-workers.

Though I usually don't award five stars for a single visit, I had such a fantastic meal and stellar time that I feel silly bestowing less.  If I could come back to one place on my next visit here, this would be it!",Le Gourmand,42 Rue Sainte-Anne,Pointe-Claire,QC,Pointe-ClaireQC,H9S 4P8,45.42924,-73.825997,4.5,21,"Chinese, Cantonese, French, Restaurants, Bars, Wine Bars, Nightlife"
798,WWNCR014lPOznbqsVKENwg,dj2KhjtZBC3Y1IrAsDXYng,0,0,0,Bacon-wrapped duck appetizer was out of this world. Lamb curry was divine. I want to go back to eat here every day. Loved everything about this place.,Le Gourmand,42 Rue Sainte-Anne,Pointe-Claire,QC,Pointe-ClaireQC,H9S 4P8,45.42924,-73.825997,4.5,21,"Chinese, Cantonese, French, Restaurants, Bars, Wine Bars, Nightlife"
799,rDSJQvtjmoFkAbLuo-RkDg,dj2KhjtZBC3Y1IrAsDXYng,3,0,3,"One of the best restaurants I've been to in a very long time.  I cannot give anything less than 5 stars.  The service and food were amazing.  We shared the 26 oz rib eye which was cooked to perfection.  We also got some smoked salmon,  king crab legs and ecargots which were also delicious.  The waitresses were always smiling and super friendly.  It's worth the price coming here and i can't wait to go back.",Le Gourmand,42 Rue Sainte-Anne,Pointe-Claire,QC,Pointe-ClaireQC,H9S 4P8,45.42924,-73.825997,4.5,21,"Chinese, Cantonese, French, Restaurants, Bars, Wine Bars, Nightlife"
800,368_2exsuKEJulJtSa_UpA,dj2KhjtZBC3Y1IrAsDXYng,1,0,1,Great when it's good but tends to be uneven.,Le Gourmand,42 Rue Sainte-Anne,Pointe-Claire,QC,Pointe-ClaireQC,H9S 4P8,45.42924,-73.825997,4.5,21,"Chinese, Cantonese, French, Restaurants, Bars, Wine Bars, Nightlife"
801,JverSjV-R13TE7gp8I__fg,dj2KhjtZBC3Y1IrAsDXYng,0,0,0,"Good, not great. Beautiful building. Ordinary service. Prices are reasonable. A better choice than those strip mall parking lot terraces. Has a nice lunch menu.",Le Gourmand,42 Rue Sainte-Anne,Pointe-Claire,QC,Pointe-ClaireQC,H9S 4P8,45.42924,-73.825997,4.5,21,"Chinese, Cantonese, French, Restaurants, Bars, Wine Bars, Nightlife"
802,iQ8VplW1xgYN7SRz_2yFfA,dj2KhjtZBC3Y1IrAsDXYng,0,0,1,"Very classy place, I ate her for lunch with a work group and we all enjoyed ourselves on the outdoor area.  Good seafood, great wine list and service was friendly.",Le Gourmand,42 Rue Sainte-Anne,Pointe-Claire,QC,Pointe-ClaireQC,H9S 4P8,45.42924,-73.825997,4.5,21,"Chinese, Cantonese, French, Restaurants, Bars, Wine Bars, Nightlife"
803,o18iOaoHW--0f91QK9K16w,dj2KhjtZBC3Y1IrAsDXYng,0,0,0,"Cozy restaurant packed with atmosphere! We had a window seat for two upstairs. Very romantic. Food was delicately seasoned so natural flavors came out. The Caesar salad had just a few small pieces of bacon and the poutine had a little bacon as well. Nice touch. The asparagus was shaved at the bottom and lightly buttered. The rib eye was outstanding grilled to perfection!  Dessert was a chocolate mousse cake - sinful! Portions were perfectly sized which I always appreciate. The staff were all polite, professional and attentive. Seriously with the trip!",Le Gourmand,42 Rue Sainte-Anne,Pointe-Claire,QC,Pointe-ClaireQC,H9S 4P8,45.42924,-73.825997,4.5,21,"Chinese, Cantonese, French, Restaurants, Bars, Wine Bars, Nightlife"
804,Ta8NSxzdrpeplyRGCsfJHA,dj2KhjtZBC3Y1IrAsDXYng,3,0,2,"Quelle belle surprise en découvrant ce resto de Pointe-Claire!  Immeuble de pierre, très chaleureux, au service hors-pair et très aimable!  La cuisine est française mais avec une touche très ""été"" ou californienne.  La soupe froide Vichyssoise valait le coup, de même que le filet mignon avec pinces de crabe, très bien réussi!",Le Gourmand,42 Rue Sainte-Anne,Pointe-Claire,QC,Pointe-ClaireQC,H9S 4P8,45.42924,-73.825997,4.5,21,"Chinese, Cantonese, French, Restaurants, Bars, Wine Bars, Nightlife"
805,YsyGDj_dDzwW7ML_txw1yQ,dj2KhjtZBC3Y1IrAsDXYng,0,0,0,"Had to make a review about my last visit to le gourmand.
This is my most favourite restaurant since they opened and I love to go there winter , spring or summer on the wonderful terrace.
So last week, my boyfriend booked and took me for my birthday. We were sat upstairs , taking an early reservation as it was just before Christmas.
Long story short, there was a party of 22 booked upstairs, they were in bar when we started our meal.
The waiter was frazzled preparing the table, going up and down the stairs and had very little time or patience for us.
He said we should enjoy the peace while we could?
Then the group came up. It was deafening, we couldn't talk and it was awful, another small group asked to move 
But weren't allowed.
It was awful, my boyfriend felt so bad.
Although the food was delicious as usual, the service and atmosphere were just awful.
The manager came up twice, pulled a face as if to say "" yikes it's noisy"" laughed and left.
No coupon given to come back, no dessert or coffee offered  to say sorry!
Nope they didn't mention the group when we booked and were only interested in our money when we left.
Have lost sooooo much respect for this restaurant.
No class what so ever.",Le Gourmand,42 Rue Sainte-Anne,Pointe-Claire,QC,Pointe-ClaireQC,H9S 4P8,45.42924,-73.825997,4.5,21,"Chinese, Cantonese, French, Restaurants, Bars, Wine Bars, Nightlife"
806,lZ2_wdnZG0RTfdMS__gBeA,dj2KhjtZBC3Y1IrAsDXYng,1,0,0,One if the best restaurants in the west island for good and ambiance. Excellent romantic date place or lunch with friends,Le Gourmand,42 Rue Sainte-Anne,Pointe-Claire,QC,Pointe-ClaireQC,H9S 4P8,45.42924,-73.825997,4.5,21,"Chinese, Cantonese, French, Restaurants, Bars, Wine Bars, Nightlife"
807,9vFqWj03FXotfLCvhCegVw,dj2KhjtZBC3Y1IrAsDXYng,0,0,0,"When you walk into the doorstep at the Le Gourmand it is like time-travel in old France. The rock walls and heavy wood beams take you back in time to a place where simplicity it is more appreciated than new technology, and yet the complex extraordinary flavors of the food you can experience here makes you want to finish your dish and ask for more.
I am originally from Italy lived and worked all over the world and settled in the USA 20 years ago and still travel for work every week, I crisscross between airports, hotels, rental car centers and usually if alone and I don't need to entertain clients I eat at my hotel...well I am glad I did not do that tonight! Experience for yourselves! Bon appetit! I will be back for more!!!",Le Gourmand,42 Rue Sainte-Anne,Pointe-Claire,QC,Pointe-ClaireQC,H9S 4P8,45.42924,-73.825997,4.5,21,"Chinese, Cantonese, French, Restaurants, Bars, Wine Bars, Nightlife"
808,0YX2EF3sMyKfrR_tptPrrg,dj2KhjtZBC3Y1IrAsDXYng,1,0,1,"I enjoyed this quaint resto. For some reason I didn't want to sit out in the terrace. I found it to be romantic inside with the stone walls surrounding you. The staff service was excellent always making sure we had everything! We went for lunch so it was quiet inside which I just loved. We had the beef steak which was to perfection with sweet potatoes fries with truffles and shaved Parmesan. 
Delish! I really like romantic little  spots and this is one of them... A Gem!",Le Gourmand,42 Rue Sainte-Anne,Pointe-Claire,QC,Pointe-ClaireQC,H9S 4P8,45.42924,-73.825997,4.5,21,"Chinese, Cantonese, French, Restaurants, Bars, Wine Bars, Nightlife"
809,pl28hBodqf11aU8lefWkng,dj2KhjtZBC3Y1IrAsDXYng,0,0,0,"I have lived in Pointe-Claire all my life and love it! 
Might of come here YEARS ago for lunch.  Had the pleasure of going back with my brother & sister for dinner.
Did NOT disappoint 
All our meals were on pointe - staff was great and the upstairs super cozy!
I love in Toronto but mom is still here so I will make it a tradition to come for 1 meal during my visits",Le Gourmand,42 Rue Sainte-Anne,Pointe-Claire,QC,Pointe-ClaireQC,H9S 4P8,45.42924,-73.825997,4.5,21,"Chinese, Cantonese, French, Restaurants, Bars, Wine Bars, Nightlife"
810,DgbTBTct_Eak4VRanfSUuA,dj2KhjtZBC3Y1IrAsDXYng,0,0,0,We won here for a business dinner and everything was absolutely phenomenal there was a little bit of a wait it was well worth it the owner came over and greeted us and because we waited even offered us a free cocktail and gave us an appetizer while we waited,Le Gourmand,42 Rue Sainte-Anne,Pointe-Claire,QC,Pointe-ClaireQC,H9S 4P8,45.42924,-73.825997,4.5,21,"Chinese, Cantonese, French, Restaurants, Bars, Wine Bars, Nightlife"
811,Of0pt1W6WxDjAEneHr2mBQ,lukgo76fgTo-llcXDdsdUA,0,0,0,I had the chicken burrito which was a good size but felt that it was a little cold. I asked for spicey and the spice was good. If it was warmer i would have given 4 stars.,Quesada Burritos & Tacos,"6361 Autoroute Transcanadienne, Unit 116",Pointe-Claire,QC,Pointe-ClaireQC,H9R 5A5,45.4681816,-73.8246835,3.0,5,"Fast Food, Mexican, Restaurants"
812,Ym26ODDlqbWVjiZqqYqznQ,lukgo76fgTo-llcXDdsdUA,1,1,0,"This was a huge disappointment.
There was some confusion with our orders.  The manager made no attempt,
what so ever, to help solve the issue.  Just yelled at us to get out of 'his' restaurant.  
My fish taco was not like any fish taco I have ever eaten, hard tortilla, which were broken and loaded with chipotle.  
One grandson ordered a taco salad.  Never seen one like what he got.
Most unappetizing presentation.

Tables were dirty and so were the floors.
Never again.  Rudeness doesn't do a business any good.",Quesada Burritos & Tacos,"6361 Autoroute Transcanadienne, Unit 116",Pointe-Claire,QC,Pointe-ClaireQC,H9R 5A5,45.4681816,-73.8246835,3.0,5,"Fast Food, Mexican, Restaurants"
813,KxJ-eOkh5g3TJnB__H5IUw,lukgo76fgTo-llcXDdsdUA,0,0,0,"I really enjoy a good burrito bowl. Their menu consists of burritos, burrito bowls, tacos, quesadillas, tortilla salad bowls and nachos. This place also offers fresh ingredients like shredded lettuce, corn, salsa, cilantro, cheese,  etc...

I ordered their bean burrito salad bowl. And with all those fresh ingredients, the flavor was just not there for me. I also went the vegetarian route, expecting the guacamole to be included, but there is an extra cost. It fell short of beans, as the portions were small.

The prices are pretty good. And, the customer service was really good. But, overall it was just ok for me.",Quesada Burritos & Tacos,"6361 Autoroute Transcanadienne, Unit 116",Pointe-Claire,QC,Pointe-ClaireQC,H9R 5A5,45.4681816,-73.8246835,3.0,5,"Fast Food, Mexican, Restaurants"
814,E162Dddc0M5YpublV2sNig,lukgo76fgTo-llcXDdsdUA,0,0,0,"What an enjoyable experience for a fast food joint. The food is pleasant as the service. 

A limited variety of choices but covering the most of the usual dishes/ sandwiches. 

So if you are on the run and want something fast and fulfilling, go on and try it.",Quesada Burritos & Tacos,"6361 Autoroute Transcanadienne, Unit 116",Pointe-Claire,QC,Pointe-ClaireQC,H9R 5A5,45.4681816,-73.8246835,3.0,5,"Fast Food, Mexican, Restaurants"
815,f8DwGF2Y74xrLWuBvAhbQw,lukgo76fgTo-llcXDdsdUA,3,0,2,"I absolutely love Mexican food, so when I heard there was a new place for me to get some quesadillas, I could not wait to try it.  I am so glad that we finally made it out to Quesada today.

I ordered the chicken quesadilla and of course, said yes to the fresh guacamole.  I was pleased, because the person I was with, ordered one of the HUGE burritos before me and when they asked him if he wanted the guac, he said yes too, but his server did not mention that there was an extra charge.  No, it's not a lot of money- I think about 70 cents extra, but he would have rather known, so just be aware of what ingredients you want added to your dish.  The prices are on the menu overhead, but in the excitement of ordering the delicious food, you may not think about it.  

I have heard that your experience depends on the people working at the time, but other than that one hiccup, the service was very pleasant.  The music was a tad loud so we had to say ""Excuse me?"" a few times while ordering to understand what they were asking.  Once you order and they heat your meal, you are able to sit down and your meals will be brought to  you at your table.

Overall, the service was fast, and the restaurant itself is kept very clean.  The cost of the food is great for the portion sizes you get.  I was highly impressed and being able to customize even your quesadillas like you would a Subway sandwich, made it taste phenomenal.  The churros were tasty and their burritos are also delicious.

I will definitely be back to try more of their menu, such as their burrito bowls- those look delicious too!  I would definitely recommend this restaurant.",Quesada Burritos & Tacos,"6361 Autoroute Transcanadienne, Unit 116",Pointe-Claire,QC,Pointe-ClaireQC,H9R 5A5,45.4681816,-73.8246835,3.0,5,"Fast Food, Mexican, Restaurants"
816,Et56ENBtzPOR5H4ULVWl1w,T7o6wNTuR1oAZcvQVlRifQ,0,0,0,"Awesome menu and bowl variety, love their eco friendly bowls as well! :) Not too spacious but food is good",Moushi,3593 Boulevard Saint-Jean,Pointe-Claire,QC,Pointe-ClaireQC,H9G 1W9,45.4706152,-73.8316449,4.0,7,"Food, Poke, Acai Bowls, Sushi Bars, Restaurants"
817,whAy1iThOkuhI4cA1B2YEw,T7o6wNTuR1oAZcvQVlRifQ,0,0,0,"My friend ordered the salmon and tuna salads for us, and it was amazing. Really flavourful, tastes pretty healthy and very filling. Unfortunately, my friend had the chicken salad, which she did not like as much. But I would eat here again.",Moushi,3593 Boulevard Saint-Jean,Pointe-Claire,QC,Pointe-ClaireQC,H9G 1W9,45.4706152,-73.8316449,4.0,7,"Food, Poke, Acai Bowls, Sushi Bars, Restaurants"
818,irc2sbDptuLdVZc6hzmssA,T7o6wNTuR1oAZcvQVlRifQ,1,0,0,"I like it. We often get bowls from there, my wife really likes it. Everything is fresh and made to order. Only things that bother me are the absence of a kids menu, and I believe it's slightly overpriced... they should revise and I think they'll increase their popularity. But all in all a good option.",Moushi,3593 Boulevard Saint-Jean,Pointe-Claire,QC,Pointe-ClaireQC,H9G 1W9,45.4706152,-73.8316449,4.0,7,"Food, Poke, Acai Bowls, Sushi Bars, Restaurants"
819,yNa4A84qyTw6XHErattcqw,T7o6wNTuR1oAZcvQVlRifQ,0,1,1,Poke bowls ... are very popular and healthy. Nice not have to drive to the city to have fresh poke bowls. The choices were very good. I have attached the menu . I ordered the Ahi Tuna which was very flavoured. Everything was fresh. My partner orders  the salmon bowl. Which she said was amazing. The only negatives was there is limited seating and the bowls were a little small. Overall it was great and we will be back.,Moushi,3593 Boulevard Saint-Jean,Pointe-Claire,QC,Pointe-ClaireQC,H9G 1W9,45.4706152,-73.8316449,4.0,7,"Food, Poke, Acai Bowls, Sushi Bars, Restaurants"
820,CxVqHxaRx6du5p0v1uPSSg,T7o6wNTuR1oAZcvQVlRifQ,1,0,0,"First time here and ordered the chicken bowl. It was excellent! Just enough spice hint to make my mouth happy while I enjoyed the chicken, rice, corn, and all the other fresh additions. Good place. Will be back!",Moushi,3593 Boulevard Saint-Jean,Pointe-Claire,QC,Pointe-ClaireQC,H9G 1W9,45.4706152,-73.8316449,4.0,7,"Food, Poke, Acai Bowls, Sushi Bars, Restaurants"
821,-ObmoYl6-AKS9qNDNsojcg,T7o6wNTuR1oAZcvQVlRifQ,0,0,0,"It's faster than what you think, in and out under 15 minutes, if you are on a short break and wanted to eat kinda of healthy choice, this is your spot if you don't mind spending a $20 (Average) otherwise just go to regular sushi restaurant.",Moushi,3593 Boulevard Saint-Jean,Pointe-Claire,QC,Pointe-ClaireQC,H9G 1W9,45.4706152,-73.8316449,4.0,7,"Food, Poke, Acai Bowls, Sushi Bars, Restaurants"
822,ngeD1XGSDBTBP61kyCCiLw,T7o6wNTuR1oAZcvQVlRifQ,1,0,0,Hands down my favourite place for takeout after a long week. Portions are generous. Great flavours & lots of choice. Also serves poke bowls w cooked protein (shrimp & chicken) for those who don't eat raw fish. Enjoy!,Moushi,3593 Boulevard Saint-Jean,Pointe-Claire,QC,Pointe-ClaireQC,H9G 1W9,45.4706152,-73.8316449,4.0,7,"Food, Poke, Acai Bowls, Sushi Bars, Restaurants"
823,CbmKn9ivqJJ0hRKabDda_g,f7DDGW645h9OMw2LIGJX0A,0,0,0,La nourriture est très bonne et le bar est efficace. Tout un atmosphère. Dommage que la terrasse donne sur le stationnement. Les hamburgers sont excellent ainsi que les frites maison. Le bar est toujours assez occupé. Possibilité de commander des plats à partager entre amis touts en prenant un verre. Beaucoup de bruit à l intérieur et beaucoup  de réguliers à grande gueule surtout sur la terrasse. Malgré tout c'est un bon endroit si le bruit ne vous dérange pas.,Marlowe,981 Boulevard Saint-Jean,Pointe-Claire,QC,Pointe-ClaireQC,H9R 5K3,45.4699759,-73.830921,4.0,4,"Mediterranean, Nightlife, Bars, Lounges, Restaurants, Tapas Bars"
824,VXtZ4EvbvRgjp1sq739lBA,f7DDGW645h9OMw2LIGJX0A,0,0,1,"Great atmosphere, warm and cosy. The hostess are extremely friendly and helpful.

Tried the calamity, they were perfectly cocked, ""al-dente"". The breading was light but with a slight spicy bite. The duping sauce was awesome with its own kick.

The muscles are also highly recommended with a Spanish twist adding chorizo.

I would definitely  come back for the food.

The only thing they are missing is a dance floor. The music was great and several patrons were dancing in their chairs.",Marlowe,981 Boulevard Saint-Jean,Pointe-Claire,QC,Pointe-ClaireQC,H9R 5K3,45.4699759,-73.830921,4.0,4,"Mediterranean, Nightlife, Bars, Lounges, Restaurants, Tapas Bars"
825,krAHGDRG7HOjErxHEZqaDw,f7DDGW645h9OMw2LIGJX0A,0,0,0,"Great menu. Everything I have eaten so far has been great. From sliders to lamb lolipops, pizza, oysters, dumplings etc ... Something for everyone and the bar always has friendly poeple and good music",Marlowe,981 Boulevard Saint-Jean,Pointe-Claire,QC,Pointe-ClaireQC,H9R 5K3,45.4699759,-73.830921,4.0,4,"Mediterranean, Nightlife, Bars, Lounges, Restaurants, Tapas Bars"
826,aFvOI2LZfz3TemifRCAqBw,f7DDGW645h9OMw2LIGJX0A,0,0,0,"Marolwe - Eatery- Bar - Vodka Emporium 

I went there for lunch to celebrate a birthday. We decided to go at 1:00 to avoid the lunch rush - it was the right move. 

When we arrived there was a steady stream of people leaving. We were five plus two children (a toddler and a five-year-old) - I have to point out that this isn't the place for children (no highchairs available), however they were accommodating   - even bringing crayons and a colouring pad for the little one.

We all ordered from the lunch menu which came with a choice of Salad or Soup - everyone picked the Salad which consisted of baby greens, sliced cucumber and alas winter tomatoes (not ripe), the dressing was a basic balsamic emulsion. Two of us ordered the Mussles and Belgian frites - both cooked perfectly - the mussles were in a nice broth. It would be nice to be given a choice of mayo or ketchup for the fries. Two ordered the Capellini and Meatballs. We had to ask for Parmesan it wasn't automatically offered.  And finally one ordered a Roast Beef Sandwich - it came with the frites and a dipping sauce. Everyone gave the food a thumbs up and all the portions were very generous. 

Service was a littler slow - our server kept disappearing for long periods; she was very nice though and was even dancing with the baby at one point - so cute.  My lunch came to just under $17 including taxes and a Perrier.

This place has been around for many years and is still seems to be going strong, so kudos to them. One drawback was the state of the washroom - in all fairness we did arrive after the busy lunch rush, but still.

Well worth it, good bang for your buck - I haven't been in awhile but glad I rediscovered the place and plan to go back for dinner and to sample the Vodka emporium. 

Cheers!",Marlowe,981 Boulevard Saint-Jean,Pointe-Claire,QC,Pointe-ClaireQC,H9R 5K3,45.4699759,-73.830921,4.0,4,"Mediterranean, Nightlife, Bars, Lounges, Restaurants, Tapas Bars"
827,FJi-7junYUfh5H1k1dXFPQ,f7DDGW645h9OMw2LIGJX0A,1,0,1,"Little update - after speaking with my dining companions I discovered that not everyone was as happy as I originally thought, so here are the comments. 

""...thought the service a little on the slow side , seeing as we were very few customers. Would have liked to see some bread on offer , rather tasty with pasta and moules, although probably better for our figures. Found the place dark and unattractive but then it is meant to be a bar. Would not be tempted to go back.
My meal was just OK.""

And

""Thought the resto was nice , good food,
good value. I had the roast beef sandwich, very juicy, not dried out! Would definitely go back! I don't think the server told us her name ! Could it be?""",Marlowe,981 Boulevard Saint-Jean,Pointe-Claire,QC,Pointe-ClaireQC,H9R 5K3,45.4699759,-73.830921,4.0,4,"Mediterranean, Nightlife, Bars, Lounges, Restaurants, Tapas Bars"
828,v1uVNymmZEndKyQrefKPJg,K0QXbMnH3ZVgg-0EuGYT9Q,0,0,0,Really good smoked meat.  Great fries too.  Service was excellent.,Moe's Bar & Grill,940 Boulevard Saint-Jean,Pointe-Claire,QC,Pointe-ClaireQC,H9R 5N8,45.46764,-73.831312,4.0,18,"Barbeque, Restaurants, Bars, Nightlife"
829,bjOrhs_cAqYjdELxySLb5A,K0QXbMnH3ZVgg-0EuGYT9Q,0,0,0,"I'll keep this short and simple.

The smoked meat. That's all I've tried here and that's what I will keep ordering. It is GOOD! I got the Reuben sandwich, which was smoked meat, sauerkraut, swiss cheese and some russian dressing on pumpernickel bread. 

TASTEGASM!

So, so good. The smoked meat was juicy, tasty and felt 'fresh', if that makes any sense. The fries, on the other hand, was a bit too greasy and soggy for my tastes. The waiter had assured me that they cut them by hand and fry them, and that its ""not McCains"". But.. greasy. I wasn't a fan.

We also had the Ferrero Rocher cake, which was huge and quite good.

Service was passable. I wish he asked me if the fries were okay, because we pretty much left it untouched.",Moe's Bar & Grill,940 Boulevard Saint-Jean,Pointe-Claire,QC,Pointe-ClaireQC,H9R 5N8,45.46764,-73.831312,4.0,18,"Barbeque, Restaurants, Bars, Nightlife"
830,TuBGwnF43pUhu2ec69OXkA,K0QXbMnH3ZVgg-0EuGYT9Q,1,0,1,"Stayed a week in Montreal, this was the best meal we had all week. Great staff, they were really on it. food came out fast. The Cajun salmon was probably the best salmon I've ever had. cooked perfectly, served with a spicy Cajun glaze, and the sun dried tomato angel hair pasta was  outstanding. It was a Wednesday night and they were very busy, so you know they're doing things right. Definitely be back next time in town.",Moe's Bar & Grill,940 Boulevard Saint-Jean,Pointe-Claire,QC,Pointe-ClaireQC,H9R 5N8,45.46764,-73.831312,4.0,18,"Barbeque, Restaurants, Bars, Nightlife"
831,Ar5T3XuHnrmtTWATP2WjQQ,K0QXbMnH3ZVgg-0EuGYT9Q,0,0,0,"Fun spot and great breakfast. Bar area can be fun as well. Very involved ownership so service is always top notch. 
A tad expensive for the portions you get but a huge variety of plates",Moe's Bar & Grill,940 Boulevard Saint-Jean,Pointe-Claire,QC,Pointe-ClaireQC,H9R 5N8,45.46764,-73.831312,4.0,18,"Barbeque, Restaurants, Bars, Nightlife"
832,gME7ZSQOyNcIGMzmdLjdOQ,K0QXbMnH3ZVgg-0EuGYT9Q,1,0,0,"Stopped here with some colleagues before heading to the airport and was really impressed. I had the grilled veggie panini with fries both of which were really yummy. Lots of veggies on the sandwich, hand cut fries, and nothing was overly greasy. Good service and decent atmosphere I would definitely try it again.",Moe's Bar & Grill,940 Boulevard Saint-Jean,Pointe-Claire,QC,Pointe-ClaireQC,H9R 5N8,45.46764,-73.831312,4.0,18,"Barbeque, Restaurants, Bars, Nightlife"
